{
  "record_version": "0.2.0",
  "record_id": "OPW-S02-SYNTHETIC-001",
  "purpose": {"scenario_id": "S02", "public_question": "Can a low-speed delivery robot yield to pedestrians and return to a marked bay without blocking the accessible route?", "ordinary_service": "Ordinary walking remains available; a person or hand cart can complete the delivery without the device."},
  "window": {"stage": "rehearsal", "status": "proposed", "planned_start": null, "planned_end": null},
  "place_window": {"spatial_ref": "geometry/roads.geojson#ROAD-001", "boundary_status": "provisional", "route_rule": "The accessible walking route stays open; the rehearsal stops if a person needs the full route width.", "capacity_rule": "One synthetic device run, one human spotter and one marked return bay; no live delivery or public-road release."},
  "public_interface": {"notice": "SYNTHETIC REHEARSAL / NO LIVE DELIVERY / HUMAN MAY STOP", "accessibility": "Paper notice, visible stop state, clear route and a non-digital explanation are mandatory.", "complaint_route": "A person may ask the spotter to stop and report the event to the named review team; no automated decision affects them.", "non_ai_alternative": "A hand cart or human delivery provides the same ordinary service while the rehearsal is paused or withdrawn."},
  "human_control": {"accountable_role": "future authorized test-responsible entity", "stop_role": "human spotter with immediate authority to stop", "review_roles": ["accessibility reviewer", "site safety reviewer", "maintenance representative", "resident observer"], "stop_triggers": ["pedestrian conflict", "route obstruction", "stop signal failure", "spotter loses sight", "return bay unavailable"], "decision_rights": ["spotter can stop the run", "accessibility reviewer can reject the route", "review team can withdraw the window"]},
  "data_contract": {"purpose": "Synthetic fixture for a bounded safety rehearsal; it records no real delivery transaction.", "minimum_fields": ["synthetic_run_id", "route_window", "yield_event", "stop_event", "bay_return"], "personal_data_scope": "none", "retention_rule": "Delete the synthetic event log after the human review packet is reproduced.", "deletion_check": "The reviewer records deletion of the synthetic log without deleting any public-service record."},
  "observation": {"baseline_status": "missing", "observation_set": ["yield success", "visible stop response", "accessible-route continuity", "bay-return completeness"], "result_status": "not_run", "review_method": "Compare a future witnessed rehearsal against the ordinary walking route; no result is inferred from this fixture."},
  "release_decision": {"decision": "hold", "reason": "This package contains a synthetic record only; site, accessibility and safety evidence are not yet available.", "next_gate": "Independent accessibility and safety review before any bounded test is considered.", "signed_at": null},
  "restoration": {"ordinary_use_path": "Remove the device, reopen the ordinary route and provide hand-cart or human delivery.", "asset_action": "Keep only the schema and review note; delete the synthetic event log after review.", "public_record": "Publish the decision, stop reason and correction or withdrawal note without personal data."},
  "disclaimer": "Synthetic concept-only example. It demonstrates an original reversible test-window record, not robot performance, public acceptance, legal compliance or deployment approval."
}
